{
  "schemaVersion": "1.0",
  "status": "proposed",
  "workbook": {
    "fileName": "sample.xlsx",
    "sheetsReviewed": [
      "Source requests to canonical",
      "Canonical to target"
    ]
  },
  "evidence": [
    {
      "sheet": "Source requests to canonical",
      "cells": [
        "A1",
        "D1",
        "J1"
      ],
      "finding": "The sheet provides a JSON request, DataWeave transformation, and canonical JSON output."
    },
    {
      "sheet": "Canonical to target",
      "cells": [
        "A1",
        "I1",
        "P1"
      ],
      "finding": "The canonical message is transformed into a target JSON request."
    },
    {
      "sheet": "Canonical to target",
      "cells": [
        "I4",
        "I9"
      ],
      "finding": "Classification values are mapped to target classification identifiers."
    }
  ],
  "assumptions": [
    {
      "id": "A-001",
      "statement": "Confirm the operator and private-network execution environment for the Source helper; it sends sanitized service requests to the service-requests queue using Microsoft Entra authentication.",
      "mustConfirmBeforeImplementation": true
    },
    {
      "id": "A-002",
      "statement": "Confirm the mock target consumer's message contract and ownership; the lab does not require real external-system accounts or credentials.",
      "mustConfirmBeforeImplementation": true
    },
    {
      "id": "A-003",
      "statement": "DataWeave behavior will be reimplemented and tested rather than executed directly.",
      "mustConfirmBeforeImplementation": false
    },
    {
      "id": "A-004",
      "statement": "The Source tab's canonical Output feeds Canonical to target Input via canonical-requests/target-transform. Confirm the link against sanitized payload evidence and any available architecture diagram; do not infer it from tab order.",
      "mustConfirmBeforeImplementation": true
    },
    {
      "id": "A-005",
      "statement": "A mock consumer of target-requests/mock-target verifies the final Output. Confirm mock-consumer ownership and duplicate-handling behavior before testing.",
      "mustConfirmBeforeImplementation": true
    }
  ],
  "flows": [
    {
      "name": "service-request-to-canonical",
      "trigger": "Receive and lock from Service Bus queue service-requests",
      "sourceFormat": "JSON service request",
      "targetFormat": "Canonical message JSON",
      "steps": [
        "Implement only the processing tab Source requests to canonical.",
        "Provide a parameterized Source helper that sends its sanitized Input fixture to service-requests with content type, message ID, and correlation ID.",
        "Validate the inbound Input against its payload contract.",
        "Apply this tab's transformation rules to produce and validate the canonical Output.",
        "Publish Output to canonical-requests; subscription target-transform supplies the Canonical to target workflow.",
        "Complete the service-requests message only after successful publication."
      ],
      "failureBehavior": "Do not complete Input on validation, transformation, or publication failure. Apply bounded retries and dead-letter policy; preserve correlation and handle duplicates if publication succeeds but completion fails."
    },
    {
      "name": "canonical-to-target",
      "trigger": "Receive and lock from Service Bus topic canonical-requests, subscription target-transform",
      "sourceFormat": "Canonical message JSON",
      "targetFormat": "Target JSON request",
      "steps": [
        "Implement only the processing tab Canonical to target.",
        "Validate canonical Input against this tab's payload contract.",
        "Apply transformation rules and classification lookups to produce and validate target Output; any XRef entries are lookup artifacts, not workflows.",
        "Publish Output to target-requests for the mock-target subscription.",
        "Complete the target-transform message only after successful publication."
      ],
      "failureBehavior": "Do not complete Input on invalid canonical data, unmapped classification, or failed Output publication. Apply bounded retries and dead-letter policy and record only sanitized diagnostics and correlation identifiers."
    }
  ],
  "azureResources": [
    {
      "type": "Private Logic App Standard hosting foundation",
      "purpose": "Host both tab workflows with the workshop network and keyless host-storage baseline.",
      "required": true,
      "costBearing": true
    },
    {
      "type": "Logic App Standard workflows",
      "purpose": "One workflow for Source requests to canonical and one for Canonical to target; informational architecture and XRef tabs do not become workflows.",
      "required": true,
      "costBearing": false
    },
    {
      "type": "Service Bus namespace",
      "purpose": "Provide durable Source ingress and topic/subscription handoffs with the approved private connectivity and a topic-capable SKU.",
      "required": true,
      "costBearing": true
    },
    {
      "type": "Service Bus queue service-requests",
      "purpose": "Receive sanitized Input messages from the Source helper for the Source workflow.",
      "required": true,
      "costBearing": false
    },
    {
      "type": "Service Bus topic canonical-requests and subscription target-transform",
      "purpose": "Route the Source workflow's canonical Output to Canonical to target Input.",
      "required": true,
      "costBearing": false
    },
    {
      "type": "Service Bus topic target-requests and subscription mock-target",
      "purpose": "Expose the last processing tab's target Output to the approved mock consumer.",
      "required": true,
      "costBearing": false
    },
    {
      "type": "Application Insights",
      "purpose": "Record correlated operational telemetry without full payloads.",
      "required": true,
      "costBearing": true
    },
    {
      "type": "Key Vault",
      "purpose": "Reference an external-system credential only if managed identity or federation is unavailable.",
      "required": false,
      "costBearing": true
    },
    {
      "type": "API Management",
      "purpose": "Not selected for broker-based Source helper ingress; consider only if a separately approved API ingress requirement exists.",
      "required": false,
      "costBearing": true
    }
  ],
  "identityBoundaries": [
    {
      "identity": "Source helper operator's Microsoft Entra identity",
      "resource": "Service Bus queue service-requests",
      "permissions": "Azure Service Bus Data Sender",
      "scope": "service-requests queue only"
    },
    {
      "identity": "Logic App system-assigned managed identity",
      "resource": "service-requests queue and canonical-requests/target-transform subscription",
      "permissions": "Azure Service Bus Data Receiver",
      "scope": "Separate assignments at the input queue and input subscription; shared site identity, not per-workflow identities"
    },
    {
      "identity": "Logic App system-assigned managed identity",
      "resource": "canonical-requests and target-requests topics",
      "permissions": "Azure Service Bus Data Sender",
      "scope": "Separate assignments at each output topic"
    },
    {
      "identity": "Approved mock consumer or mock adapter identity",
      "resource": "target-requests/mock-target subscription",
      "permissions": "Azure Service Bus Data Receiver",
      "scope": "mock-target subscription only"
    },
    {
      "identity": "Host-storage user-assigned managed identity",
      "resource": "Logic App host storage",
      "permissions": "Blob, Queue, and Table Data Contributor",
      "scope": "Host storage account only"
    },
    {
      "identity": "Logic App system-assigned managed identity",
      "resource": "Optional Key Vault",
      "permissions": "Only the data-plane roles required by the approved implementation",
      "scope": "Each individual workload resource"
    }
  ],
  "reliability": [
    "Confirm lock duration and renewal, retry limits, maximum delivery count, TTL, and dead-letter ownership before implementation.",
    "Complete each Input only after publishing validated Output; failed publication leaves Input unsettled for the approved failure policy.",
    "Use stable message IDs and explicit duplicate handling for retries and replay, including publication success followed by completion failure.",
    "Define target timeouts and classify transient versus permanent failures.",
    "Disable unsafe automatic retries for non-idempotent target writes unless an idempotency key is confirmed.",
    "Preserve one correlation identifier through the Source helper, both tab workflows, every broker handoff, and the approved mock consumer."
  ],
  "observability": [
    "Record workflow, stage, duration, result, and correlation identifier.",
    "Do not record complete source, canonical, or target payloads.",
    "Create a failure query and alert only after expected volume and support ownership are known."
  ],
  "security": [
    "Use HTTPS with TLS 1.2 or later.",
    "Keep Logic App host storage private and keyless.",
    "Use Microsoft Entra authentication for the Source helper and managed identity for workflow broker access; confirm private-network reachability without weakening public-access policy.",
    "Do not place external-system credentials, callback URLs, or customer payloads in source, outputs, state, or telemetry."
  ],
  "implementationStages": [
    {
      "stage": 1,
      "outcome": "Approve the evidence, assumptions, service selection, and target contract."
    },
    {
      "stage": 2,
      "outcome": "Implement and deploy the approved private hosting foundation, integration resources and access, two tab workflows, transformations and lookup artifacts, and Source helper; prove success and failure behavior against sanitized fixtures and a mock consumer."
    }
  ],
  "validation": [